{
  "ok": true,
  "entryId": "01JAF1ENTRY000000000000001",
  "entryNo": 132,
  "created": true,
  "draftRevisionId": "v1",
  "rev": "v1",
  "path": "/spa-services/hot-tub-heater-repair/",
  "editUrl": "https://oasispoolspas.com/_emdash/admin/content/pages/01JAF1ENTRY000000000000001",
  "warnings": [],
  "review": null,
  "slug": "hot-tub-heater-repair",
  "parent": "spa-services",
  "bylines": [],
  "taxonomies": {},
  "seoCheck": {
    "ran": true,
    "variant": "draft",
    "ok": true,
    "summary": {
      "block": 0,
      "warn": 2,
      "info": 1
    },
    "failed": [
      {
        "id": "profile.exists",
        "severity": "warn",
        "message": "No SEO profile for pages:hot-tub-heater-repair yet",
        "path": null
      },
      {
        "id": "kw.primary-lead",
        "severity": "warn",
        "message": "Primary keyword not in the first 100 words",
        "path": "lead"
      }
    ],
    "contract": null
  },
  "entry": {
    "entryId": "01JAF1ENTRY000000000000001",
    "entryNo": 132,
    "collection": "pages",
    "slug": "hot-tub-heater-repair",
    "path": "/spa-services/hot-tub-heater-repair/",
    "title": "Hot Tub Heater Repair",
    "status": "draft",
    "hasPendingDraft": false,
    "draftRevisionId": null,
    "liveRevisionId": null,
    "seo": {
      "title": "Hot Tub Repair in Waukesha & Milwaukee | Oasis Pool and Spa",
      "description": "Hot tub not heating? Oasis repairs most spa brands across Waukesha and Milwaukee.",
      "canonical": null,
      "noIndex": false
    },
    "contentHash": "9b1f0c2d3e4a5b6c7d8e9f00112233445566778899aabbccddeeff0011223344",
    "wordCount": 812,
    "excerpt": "Oasis diagnoses and repairs most hot tub brands.",
    "updatedAt": "2026-10-15T12:01:00Z",
    "publishedAt": null,
    "scheduledAt": null,
    "editUrl": "https://oasispoolspas.com/_emdash/admin/content/pages/01JAF1ENTRY000000000000001",
    "template": null,
    "outline": {
      "headings": [
        {
          "level": 1,
          "text": "Hot Tub Repair for Most Brands"
        },
        {
          "level": 2,
          "text": "Hot tub repair questions"
        },
        {
          "level": 3,
          "text": "Why is my hot tub not heating?"
        }
      ],
      "internalLinks": [
        "/spa-services/",
        "/contact/"
      ],
      "externalLinkCount": 0,
      "imageCount": 1
    },
    "outlineHash": "fdf9c0ae7d0c95ee25b6921c6d0c988a9893787520d142903b1f1637f7cf672b"
  }
}
